"survey","survey-1","process","Definitely more step-by step. Instead of letting things sit a lot more in my head and waiting for a joke to magically pop out, I could use these strategies to help me think of things.","survey","survey-2","useTechniques","Yes. The aspects and associations ideas were most helpful. I could easily generate a bunch of different types of jokes from the subject matter those techniques helped me generate. The sarcasm / angle violations were also useful.","survey","survey-3","useful","Definitely the aspects and associations tools. It generates a bunch of great ideas for a joke and makes it much easier to finish them with either the other techniques or just by thinking.","survey","survey-4","notuseful","It was sometimes hard to remember all the vocabulary and how to use each tool, but that's more a factor of the length of the study it seemed to me. With more time I'd probably have had better memory.","survey","survey-5","recomment","Yes definitely! It's super cool, both in that it helps you make jokes, and also in that it helps you learn more about humor, language, and psychology.","survey","survey-6","age","20","survey","survey-6","field","student, STEM","survey","survey-6","gender","male","","","","","","","","","","","","","","","","","","","","","","","","","","","","","","","","","","","","","","","","","","","","","","","","","","","","","","","","","","","","","","","","","","","","","","","","","","","","","","","","","","","","","","","","","","","","","","","","","","","","","","","","","P6PjMaBeZYcKxtrZ4","1444857943327","kxZxYEY7SMXjCDYmw"
"survey","survey-1","process","I feel like I gained a strategy for writing jokes..","survey","survey-2","useTechniques","Yes- an altered angle is huge!","survey","survey-3","useful","Really rationalizing how I write jokes.","survey","survey-4","notuseful","It was a bit drawn out.","survey","survey-5","recomment","If they were interested in humor writing- yes!","survey","survey-6","age","18","survey","survey-6","field","science","survey","survey-6","gender","female","","","","","","","","","","","","","","","","","","","","","","","","","","","","","","","","","","","","","","","","","","","","","","","","","","","","","","","","","","","","","","","","","","","","","","","","","","","","","","","","","","","","","","","","","","","","","","","","","","","","","","","","","RS5cRfBwaG9MPmAwP","1445058149431","m4zJhDQoFSrJyukMQ"
"survey","survey-1","process","It was way easier, I actually had some techniques for figuring out a funny angle on the titles. It felt cool to try to put those into action rather than just think ""hm maybe I'm not funny."" ","survey","survey-2","useTechniques","Yes! I used the associations a lot, I found them really helpful for finding a new angle or a way to be sarcastic because I could very quickly put the headline in a new context and contrast it with things that might make it seem ridiculous. I used the violations because I knew that I had two choices -- helped to narrow it down and make it feel manageable. I used the expected reactions and expected beliefs because they helped me to be sarcastic more intentionally - I could use them to make sure the jokes violated expectations.","survey","survey-3","useful","Before, I was trying to think, I know there is something funny here...especially about the primate. But I was at a loss. Maybe if I had a few hours to mull it over I would have arrived at something. But the tutorial made it so that I could fire off a bunch of possibilities and hone in on what I felt was funny about it. I felt that I could express my own sense of humor better, even though I was using general techniques.","survey","survey-4","notuseful","The beliefs (e.g., pos/neg) were not so useful because I couldn't remember them, or really understand how to use them. I didn't really get that part.","survey","survey-5","recomment","Yes, I think it's fun! In the end, it felt cool to be able to write a joke. I'd like to show a friend and then compare jokes, that would be cool. It's a neat form of self-expression. I used to think being funny was just some talent some people had, but it's neat that you can work at it.","","","","","","","","","","","","","","","","","","","","","","","","","","","","","","","","","","","","","","","","","","","","","","","","","","","","","","","","","","","","","","","","","","","","","","","","","","","","","","","","","","","","","","","","","","","","","","","","","","","","","","","","","","","","","","","","","","","","","JtMRnXL523KpXbSd4","1444701999633","meN7ebcK5ETaetGdR"
"survey","survey-1","process","Not very much.","survey","survey-2","useTechniques","I used the violations a lot, those were very helpful","survey","survey-3","useful","Objectively pointing out violations was intriguing and helpful","survey","survey-4","notuseful","Some of the expected beliefs/reactions things were really intuitive","survey","survey-5","recomment","Yep!","survey","survey-6","age","21","survey","survey-6","field","student","survey","survey-6","gender","male","","","","","","","","","","","","","","","","","","","","","","","","","","","","","","","","","","","","","","","","","","","","","","","","","","","","","","","","","","","","","","","","","","","","","","","","","","","","","","","","","","","","","","","","","","","","","","","","","","","","","","","","","JAyTExdMHA6mkv74k","1444763571152","p8anFXoT5eoidvDna"
"survey","survey-1","process","Before I didn't think about it (I mean, I rarely wrote jokes anyway), but now I use ~strategy~","survey","survey-2","useTechniques","Yes, especially the angle vs. sarcasm one ","survey","survey-3","useful","The examples! Sometimes I was confused about what was happening! ","survey","survey-4","notuseful","The expected beliefs/reactions. I still don't really understand that ","survey","survey-5","recomment","Yes!","survey","survey-6","age","21","survey","survey-6","field","English","survey","survey-6","gender","female","","","","","","","","","","","","","","","","","","","","","","","","","","","","","","","","","","","","","","","","","","","","","","","","","","","","","","","","","","","","","","","","","","","","","","","","","","","","","","","","","","","","","","","","","","","","","","","","","","","","","","","","","rSuf5FGQduFzqr4yK","1444964448592","wPg9CdvJ3bJpmYkFM"
"survey","survey-1","process","I enjoyed the thought and effort that went into the jokes the second time around. However, I was more preoccupied about making them perfect/fallilng into your categories that I didn't get around to writing as many as quickly as I did before. I enjoyed writing without feeling pressured. The second time around, i felt pressured to make it perfect. This could have hurt my performance. ","survey","survey-2","useTechniques","I really enjoyed using the ""associations"" category. This required me to approach the headline from a multifaceted approach. I also explored using ""violations"" and the expected reactions section. This is because they are fairly interrelated with each other. I noticed that I didn't use the ""aspect"" box. It felt too analytical and felt that it would not get me anywhere as efficiently as the other categories.  
","survey","survey-3","useful","This process allowed for the balance of the emotional with the analytical. For example, I have to pay to what my initial gut reactions are in response to the headlines. But then, I must me self aware of what I felt in order to arrive to a potential joke response. Both aspects are used simultaneously and we are given the tools to help us be self aware. ","survey","survey-4","notuseful","I felt more self conscious the second time around. The process is still a work in progress...","survey","survey-5","recomment","Yes. If this is for someone who likes to approach humor in a more analytical way, this could be helpful. ","survey","survey-6","age","19","survey","survey-6","field","","survey","survey-6","gender","female","","","","","","","","","","","","","","","","","","","","","","","","","","","","","","","","","","","","","","","","","","","","","","","","","","","","","","","","","","","","","","","","","","","","","","","","","","","","","","","","","","","","","","","","","","","","","","","","","","","","","","","","","Eo5NpLtFszduBYtaB","1445073599865","xAY3DP3HchapsQsXL"
"survey","survey-1","process","I paid more attention to what I was writing. Before the tutorial I was mostly going on instinct or imagining what other people would say.","survey","survey-2","useTechniques","I tried to write down notes for each of the categories at the left. The most helpful one was associations. It helped me think of jokes in a wider conceptual space than I previously had.","survey","survey-3","useful","The associations part of the tutorial was the best!","survey","survey-4","notuseful","I didn't really see the point of the expected reactions. It seemed so straightforward that it didn't really help me.","survey","survey-5","recomment","Yeah I would!","survey","survey-6","age","22","survey","survey-6","field","social science","survey","survey-6","gender","female","","","","","","","","","","","","","","","","","","","","","","","","","","","","","","","","","","","","","","","","","","","","","","","","","","","","","","","","","","","","","","","","","","","","","","","","","","","","","","","","","","","","","","","","","","","","","","","","","","","","","","","","","Jex8i4gH6BaQR3gMw","1444874776671","xmaBpLzMFb6p6GB2h"
"survey","survey-1","process","Before hand it was natural, with focus being on timing and delivery.","survey","survey-2","useTechniques","yes, focusing on angle","survey","survey-3","useful","realizing the parts that were subconscious","survey","survey-4","notuseful","the aspect part","survey","survey-5","recomment","sure","survey","survey-6","age","23","survey","survey-6","field","Biology","survey","survey-6","gender","male","","","","","","","","","","","","","","","","","","","","","","","","","","","","","","","","","","","","","","","","","","","","","","","","","","","","","","","","","","","","","","","","","","","","","","","","","","","","","","","","","","","","","","","","","","","","","","","","","","","","","","","","","RQkTuYGxF5tJwK6SL","1445037503879","zH9yaHn6wsg5fcMu7"
"survey","survey-1","process","I thought about it much more structurally","survey","survey-2","useTechniques","Yes. I used the one about associations with other things and people","survey","survey-3","useful","That it was well-defined","survey","survey-4","notuseful","I didn't think that it helped with how things were funny it just gave you subjects to work with","survey","survey-5","recomment","maybe. For the money.","survey","survey-6","age","18","survey","survey-6","field","Engineering","survey","survey-6","gender","female","","","","","","","","","","","","","","","","","","","","","","","","","","","","","","","","","","","","","","","","","","","","","","","","","","","","","","","","","","","","","","","","","","","","","","","","","","","","","","","","","","","","","","","","","","","","","","","","","","","","","","","","","PuHabNAJ3ZpPJ4LCE","1444991149574","zzpBhkmf2W2aJZcrY"
